sts_code_proc,sts_name_proc,sts_code_dx,sts_name_dx,epcc_code,epcc_name,comment
2160,"Hybrid Approach ""Stage 1"", Application of RPA & LPA bands",6160,"Status post - Hybrid Approach ""Stage 1"", Application of RPA & LPA bands",12.20.21,"Hypoplastic left heart syndrome hybrid strategy (transcatheter & surgery),",
2170,"Hybrid Approach ""Stage 1"", Stent placement in arterial duct (PDA)",6170,"Status post - Hybrid Approach ""Stage 1"", Stent placement in arterial duct (PDA)",12.20.21,"Hypoplastic left heart syndrome hybrid strategy (transcatheter & surgery),",
2180,"Hybrid Approach ""Stage 1"", Stent placement in arterial duct (PDA) + application of RPA & LPA bands",6180,"Status post - Hybrid Approach ""Stage 1"", Stent placement in arterial duct (PDA) + application of RPA & LPA bands",12.10.04,"Application of bilateral pulmonary arterial bands & transcatheter placement of stent in arterial duct,",
2140,"Hybrid approach ""Stage 2"", Aortopulmonary amalgamation + Superior Cavopulmonary anastomosis(es) + PA Debanding + Aortic arch repair (Norwood [Stage 1] + Superior Cavopulmonary anastomosis(es) + PA Debanding)",6140,"Status post - Hybrid approach ""Stage 2"", Aortopulmonary amalgamation + Superior Cavopulmonary anastomosis(es) + PA Debanding + Aortic arch repair (Norwood [Stage 1] + Superior Cavopulmonary anastomosis(es) + PA Debanding)",12.20.23,"Hypoplastic left heart syndrome hybrid approach (transcatheter & surgery) 'stage 2':  aortopulmonary amalgamation + superior cavopulmonary anastomosis(es) + debanding of pulmonary arteries + arch repair,",
2150,"Hybrid approach ""Stage 2"", Aortopulmonary amalgamation + Superior Cavopulmonary anastomosis(es) + PA Debanding + Without aortic arch repair",6150,"Status post - Hybrid approach ""Stage 2"", Aortopulmonary amalgamation + Superior Cavopulmonary anastomosis(es) + PA Debanding + Without aortic arch repair",12.20.22,"Hypoplastic left heart syndrome hybrid approach (transcatheter & surgery) 'stage 2':  aortopulmonary amalgamation + superior cavopulmonary anastomosis(es) + debanding of pulmonary arteries,",
2760,"Hybrid Approach, Transcardiac balloon dilation",6760,"Status post - Hybrid Approach, Transcardiac balloon dilation",EXCLUDE,,Too non-specific
2770,"Hybrid Approach, Transcardiac transcatheter device placement",6770,"Status post - Hybrid Approach, Transcardiac transcatheter device placement",EXCLUDE,,Too non-specific
2930,Hyoid myotomy and suspension,6930,Status post - Hyoid myotomy and suspension,EXCLUDE,,Irrelevant
1320,Interrupted aortic arch repair,5320,Status post - Interrupted aortic arch repair,12.21.00,"Aortic arch repair, Interrupted aortic arch repair,",
3180,Intravascular stent removal,7180,Status post - Intravascular stent removal,EXCLUDE,,No EPCC equivalent
3160,Kawashima operation (superior cavopulmonary connection in setting of interrupted IVC with azygous continuation),7160,Status post - Kawashima operation (superior cavopulmonary connection in setting of interrupted IVC with azygous continuation),12.00.39,"Systemic vein procedure, Superior caval vein (SVC) procedure,",Closest
750,Konno procedure,4750,Status post - Konno procedure,12.16.62,"Ross-Konno procedure,",
1790,"Ligation, Pulmonary artery",5790,"Status post - Ligation, Pulmonary artery",12.14.31,"Pulmonary artery ligation,",
1830,"Ligation, Thoracic duct",5830,"Status post - Ligation, Thoracic duct",EXCLUDE,,No EPCC equivalent
1400,Lung biopsy,5400,Status post - Lung biopsy,12.32.06,"Lung procedure, Lung biopsy procedure,",
3390,LV Endocardial Fibroelastosis resection,7390,Status post - LV Endocardial Fibroelastosis resection,EXCLUDE,,Not CHD
820,LV to aorta tunnel repair,4820,Status post - LV to aorta tunnel repair,12.16.90,"Aorto-left ventricular tunnel closure,",
1970,Mediastinal exploration,5970,Status post - Mediastinal exploration,12.65.05,"Mediastinal procedure, Mediastinal exploration,",
2040,"Miscellaneous procedure, Other",6040,"Status post - Miscellaneous procedure, Other",EXCLUDE,,Irrelevant
840,"Mitral stenosis, Supravalvar mitral ring repair",4840,"Status post - Mitral stenosis, Supravalvar mitral ring repair",12.01.32,"Supra-mitral valvar LA-ring excision,",
2940,"Muscle flap, Neck",6940,"Status post - Muscle flap, Neck",EXCLUDE,,Irrelevant
2800,"Muscle flap, Trunk (i.e. intercostal, pectus, or serratus muscle)",6800,"Status post - Muscle flap, Trunk (i.e. intercostal, pectus, or serratus muscle)",EXCLUDE,,Irrelevant
2810,"Muscle flap, Trunk (i.e. latissimus dorsi)",6810,"Status post - Muscle flap, Trunk (i.e. latissimus dorsi)",EXCLUDE,,Irrelevant
1140,Mustard,5140,Status post - Mustard,12.29.02,"Mustard procedure (atrial inversion),",
2435,"Non-cardiovascular, Non-thoracic procedure on cardiac patient with cardiac anesthesia",6435,"Status post - Non-cardiovascular, Non-thoracic procedure on cardiac patient with cardiac anesthesia",12.33.53,"Non-cardiothoracic-vascular procedure on cardiac patient under cardiac anaesthesia,",
870,Norwood procedure,4870,Status post - Norwood procedure,12.10.00,"Norwood type procedure,",
450,Occlusion of MAPCA(s),4450,Status post - Occlusion of MAPCA(s),12.25.18,"Systemic-to-pulmonary collateral artery(ies) (MAPCA(s)) occlusion,",
7810,Operation aborted after skin incision,,,EXCLUDE,,Irrelevant
7800,Operation canceled before skin incision,,,EXCLUDE,,Irrelevant
2050,Organ procurement,,,12.37.70,"Organ procurement for transplantation,",
770,Other annular enlargement procedure,4770,Status post - Other annular enlargement procedure,EXCLUDE,,Irrelevant
3200,PA band adjustment,7200,Status post - PA band adjustment,12.14.08,"Open adjustment of pulmonary trunk band,",
1650,PA debanding,5650,Status post - PA debanding,12.14.03,"Pulmonary trunk band removal (de-band),",
540,"PA, reconstruction (plasty), Branch, Central (within the hilar bifurcation)",4540,"Status post - PA, reconstruction (plasty), Branch, Central (within the hilar bifurcation)",12.14.21,"Pulmonary arterioplasty/ reconstruction, Pulmonary arterioplasty/ reconstruction: central (proximal to hilar bifurcation),",
550,"PA, reconstruction (plasty), Branch, Peripheral (at or beyond the first lobar branch)",4550,"Status post - PA, reconstruction (plasty), Branch, Peripheral (at or beyond the first lobar branch)",12.14.22,"Pulmonary arterioplasty/ reconstruction, Pulmonary arterioplasty/ reconstruction: peripheral (at-beyond hilar bifurcation),",
3360,"PA, reconstruction (plasty), Branch, Peripheral (at or beyond the first lobar branch, beyond the first segmental branch)",7360,"Status post - PA, reconstruction (plasty), Branch, Peripheral (at or beyond the first lobar branch, beyond the first segmental branch)",12.14.20,"Pulmonary arterioplasty/ reconstruction,",
3350,"PA, reconstruction (plasty), Branch, Peripheral (at or beyond the first lobar branch, proximal to first segmental branch)",7350,"Status post - PA, reconstruction (plasty), Branch, Peripheral (at or beyond the first lobar branch, proximal to first segmental branch)",12.14.20,"Pulmonary arterioplasty/ reconstruction,",
530,"PA, reconstruction (plasty), Main (trunk)",4530,"Status post - PA, reconstruction (plasty), Main (trunk)",12.14.01,"Pulmonary trunk arterioplasty,",
1710,"Palliation, Other",5710,"Status post - Palliation, Other",12.43.25,"Palliative procedure,",
260,PAPVC repair,4260,Status post - PAPVC repair,12.00.02,"Partially anomalous pulmonary venous connection repair,",
2120,"PAPVC repair, Baffle redirection to left atrium with systemic vein translocation (Warden) (SVC sewn to right atrial appendage)",6120,"Status post - PAPVC repair, Baffle redirection to left atrium with systemic vein translocation (Warden) (SVC sewn to right atrial appendage)",12.00.78,"Partially anomalous pulmonary venous connection repair, Partially anomalous pulmonary venous connection repair: baffle redirection to left atrium & systemic vein translocated to right atrial appendage (Warden),",
270,"PAPVC, Scimitar, Repair",4270,"Status post - PAPVC, Scimitar, Repair",12.00.17,"Partially anomalous pulmonary venous connection repair, Scimitar syndrome (partially anomalous pulmonary venous connection) repair,",
910,Partial left ventriculectomy (LV volume reduction surgery) (Batista),4910,Status post - Partial left ventriculectomy (LV volume reduction surgery) (Batista),12.07.38,"Left ventricular procedure, Partial left ventriculectomy-volume reduction (Batista),",
1330,"PDA closure, Surgical",5330,"Status post - PDA closure, Surgical",12.24.20,"Arterial duct-ligament procedure, Arterial duct (PDA) closure, Patent arterial duct (PDA) closure: surgical,",
2990,Pectus bar removal,6990,Status post - Pectus bar removal,EXCLUDE,,Irrelevant
3000,Pectus bar repositioning,7005,Status post - Pectus bar repositioning,EXCLUDE,,Irrelevant
3010,"Pectus repair, Minimally invasive repair (Nuss), With thoracoscopy",7010,"Status post - Pectus repair, Minimally invasive repair (Nuss), With thoracoscopy",EXCLUDE,,Not CHD
3020,"Pectus repair, Minimally invasive repair (Nuss), Without thoracoscopy",7020,"Status post - Pectus repair, Minimally invasive repair (Nuss), Without thoracoscopy",EXCLUDE,,Not CHD
930,Pericardiectomy,4930,Status post - Pericardiectomy,12.32.09,"Pericardiectomy,",
2030,"Peripheral vascular procedure, Other",6030,"Status post - Peripheral vascular procedure, Other",12.33.51,"Peripheral vascular procedure,",
10,"PFO, Primary closure",4010,"Status post - PFO, Primary closure",12.01.53,"Patent foramen ovale (PFO) direct closure,",
1810,Pleural drainage procedure,5810,Status post - Pleural drainage procedure,12.32.80,"Pleural procedure, Insertion of pleural tube drain,",
2950,Procedure on neck,6950,Status post - Procedure on neck,EXCLUDE,,Not CHD
3100,Procedure on thorax,7100,Status post - Procedure on thorax,12.40.00,"Thoracotomy,",
220,Pulmonary artery origin from ascending aorta (hemitruncus) repair,4220,Status post - Pulmonary artery origin from ascending aorta (hemitruncus) repair,12.14.30,"Pulmonary artery origin from ascending aorta (hemitruncus) repair,",
1370,Pulmonary artery sling repair,5370,Status post - Pulmonary artery sling repair,12.17.32,"Vascular ring procedure, Pulmonary arterial sling repair,",
2700,"Pulmonary atresia - VSD - MAPCA repair, Complete single stage repair (1-stage that includes bilateral pulmonary unifocalization + VSD closure + RV to PA connection [with or without conduit])",6700,"Status post - Pulmonary atresia - VSD - MAPCA repair, Complete single stage repair (1-stage that includes bilateral pulmonary unifocalization + VSD closure + RV to PA connection [with or without conduit])",12.28.11,"Pulmonary atresia, ventricular septal defect (VSD) & systemic-to-pulmonary collateral artery(ies) (MAPCA(s)) repair,",
2710,"Pulmonary atresia - VSD - MAPCA repair, Status post prior complete unifocalization (includes VSD closure + RV to PA connection [with or without conduit])",6710,"Status post - Pulmonary atresia - VSD - MAPCA repair, Status post prior complete unifocalization (includes VSD closure + RV to PA connection [with or without conduit])",12.28.11,"Pulmonary atresia, ventricular septal defect (VSD) & systemic-to-pulmonary collateral artery(ies) (MAPCA(s)) repair,",
2720,"Pulmonary atresia - VSD - MAPCA repair, Status post prior incomplete unifocalization (includes completion of pulmonary unifocalization + VSD closure + RV to PA connection [with or without conduit])",6720,"Status post - Pulmonary atresia - VSD - MAPCA repair, Status post prior incomplete unifocalizarion (includes completion of pulmonary unifocalization + VSD closure + RV to PA connection [with or without conduit])",12.28.11,"Pulmonary atresia, ventricular septal defect (VSD) & systemic-to-pulmonary collateral artery(ies) (MAPCA(s)) repair,",
1780,Pulmonary AV fistula repair/occlusion,5780,Status post - Pulmonary AV fistula repair/occlusion,12.25.07,"Pulmonary arteriovenous fistula closure,",
1804,"Pulmonary embolectomy, Chronic pulmonary embolus",5804,"Status post - Pulmonary embolectomy, Chronic pulmonary embolus",12.15.81,"Pulmonary thromboembolectomy for chronic (longstanding) embolus,",
300,Pulmonary venous stenosis repair,4300,Status post - Pulmonary venous stenosis repair,12.00.03,"Pulmonary vein stenosis repair,",
2440,"Radiology procedure on cardiac patient, Cardiac Computerized Axial Tomography (CT Scan)",6440,"Status post - Radiology procedure on cardiac patient, Cardiac Computerized Axial Tomography (CT Scan)",EXCLUDE,,Irrelevant
2450,"Radiology procedure on cardiac patient, Cardiac Magnetic Resonance Imaging (MRI)",6450,"Status post - Radiology procedure on cardiac patient, Cardiac Magnetic Resonance Imaging (MRI)",EXCLUDE,,Irrelevant
2460,"Radiology procedure on cardiac patient, Diagnostic radiology",6460,"Status post - Radiology procedure on cardiac patient, Diagnostic radiology",EXCLUDE,,Irrelevant
2470,"Radiology procedure on cardiac patient, Non-Cardiac Computerized Tomography (CT) on cardiac patient",6470,"Status post - Radiology procedure on cardiac patient, Non-Cardiac Computerized Tomography (CT) on cardiac patient",EXCLUDE,,Irrelevant
2480,"Radiology procedure on cardiac patient, Non-cardiac Magnetic Resonance Imaging (MRI) on cardiac patient",6480,"Status post - Radiology procedure on cardiac patient, Non-cardiac Magnetic Resonance Imaging (MRI) on cardiac patient",EXCLUDE,,Irrelevant
2490,"Radiology procedure on cardiac patient, Therapeutic radiology",6490,"Status post - Radiology procedure on cardiac patient, Therapeutic radiology",EXCLUDE,,Too non-specific
1150,Rastelli,5150,Status post - Rastelli,12.29.11,"Rastelli procedure: intraventricular left ventricle to aorta tunnel & right ventricle to pulmonary artery conduit,",
3210,Removal of transcatheter-delivered device from blood vessel,7210,Status post - Removal of transcatheter-delivered device from blood vessel,EXCLUDE,,No match
3220,Removal of transcatheter-delivered device from heart,7220,Status post - Removal of transcatheter-delivered device from heart,EXCLUDE,,No match
2820,"Removal, Sternal wire",6820,"Status post - Removal, Sternal wire",12.65.48,"Sternal wire removal from previous sternotomy,",
1160,REV,5160,Status post - REV,12.27.45,"REV procedure: intraventricular left ventricle to aorta tunnel with infundibular septum resection & direct right ventricle to pulmonary trunk anastomosis,",
2830,"Rib excision, Complete",6830,"Status post - Rib excision, Complete",EXCLUDE,,Not CHD
3060,"Rib excision, Excision of cervical rib",7060,"Status post - Rib excision, Excision of cervical rib",EXCLUDE,,Not CHD
3070,"Rib excision, Excision of cervical rib, With sympathectomy",7070,"Status post - Rib excision, Excision of cervical rib, With sympathectomy",EXCLUDE,,Not CHD
3080,"Rib excision, Excision of first rib",7080,"Status post - Rib excision, Excision of first rib",EXCLUDE,,Not CHD
3090,"Rib excision, Excision of first rib, With sympathectomy",7090,"Status post - Rib excision, Excision of first rib, With sympathectomy",EXCLUDE,,Not CHD
2840,"Rib excision, Partial",6840,"Status post - Rib excision, Partial",EXCLUDE,,Not CHD
1920,Right/left heart assist device procedure,5920,Status post - Right/left heart assist device procedure,12.37.04,"Prosthetic heart (total artificial heart) implantation,",
740,Ross procedure,4740,Status post - Ross procedure,12.16.30,"Ross procedure: aortic valve or root replacement with pulmonary autograft & pulmonary valvar replacement,",
760,Ross-Konno procedure,4760,Status post - Ross-Konno procedure,12.16.62,"Ross-Konno procedure,",
3370,"RV Rehabilitation, Endocardial Resection",7370,"Status post - RV Rehabilitation, Endocardial Resection",EXCLUDE,,Not CHD
1130,Senning,5130,Status post - Senning,12.29.01,"Senning procedure (atrial inversion),",
1630,"Shunt, Ligation and takedown",5630,"Status post - Shunt, Ligation and takedown",12.31.30,"Systemic-to-pulmonary arterial shunt procedure,",Closest
2095,"Shunt, Reoperation",6095,"Status post - Shunt, Reoperation",12.43.00,"Reoperation,",
1600,"Shunt, Systemic to pulmonary, Central (shunt from aorta)",5600,"Status post - Shunt, Systemic to pulmonary, Central (shunt from aorta)",12.31.05,"Systemic-to-pulmonary arterial shunt procedure, Waterston (ascending aorta-right pulmonary artery) anastomosis,",
3130,"Shunt, Systemic to pulmonary, Central (shunt from aorta), Central shunt with an end-to-side connection between the transected main pulmonary artery and the side of the ascending aorta (i.e. Mee shunt)",7130,"Status post - Shunt, Systemic to pulmonary, Central (shunt from aorta), Central shunt with an end-to-side connection between the transected main pulmonary artery and the side of the ascending aorta (i.e. Mee shunt)",12.31.30,"Systemic-to-pulmonary arterial shunt procedure,",
3230,"Shunt, Systemic to pulmonary, Potts - Smith type (descending aorta to pulmonary artery)",7230,"Status post - Shunt, Systemic to pulmonary, Potts - Smith type (descending aorta to pulmonary artery)",12.31.30,"Systemic-to-pulmonary arterial shunt procedure,",
810,"Sinus of Valsalva, Aneurysm repair",4810,"Status post - Sinus of Valsalva, Aneurysm repair",12.16.85,"Aortic sinus of Valsalva procedure, Aortic sinus of Valsalva aneurysm repair,",
2850,Sternal fracture - open treatment,6850,Status post - Sternal fracture - open treatment,EXCLUDE,,Not CHD
2860,"Sternal resection, Radical resection of sternum",6860,"Status post - Sternal resection, Radical resection of sternum",EXCLUDE,,Not CHD
2870,"Sternal resection, Radical resection of sternum with mediastinal lymphadenectomy",6870,"Status post - Sternal resection, Radical resection of sternum with mediastinal lymphadenectomy",EXCLUDE,,Not CHD
1980,Sternotomy wound drainage,5980,Status post - Sternotomy wound drainage,12.65.56,"Sternotomy wound drainage,",
2330,Superior cavopulmonary anastomosis(es) (Glenn or HemiFontan) + Atrioventricular valvuloplasty,6330,Status post - Superior cavopulmonary anastomosis(es) (Glenn or HemiFontan) + Atrioventricular valvuloplasty,"12.31.22, 12.90.01",multiple_codes,2 ops
2130,Superior Cavopulmonary anastomosis(es) + PA reconstruction,6130,Status post - Superior Cavopulmonary anastomosis(es) + PA reconstruction,"12.31.72, 12.14.20",multiple_codes,2 ops
3300,Takedown of superior cavopulmonary anastomosis,7300,Status post - Takedown of superior cavopulmonary anastomosis,12.31.42,"Takedown of Glenn,",
280,TAPVC repair,4280,Status post - TAPVC repair,12.00.00,"Totally anomalous pulmonary venous connection repair,",
2200,TAPVC repair + Shunt - systemic-to-pulmonary,6200,Status post - TAPVC repair + Shunt - systemic-to-pulmonary,"12.00.00, 12.31.30",multiple_codes,2 ops
2210,"TGA, Other procedures (Kawashima, LV-PA conduit, other)",6210,"Status post - TGA, Other procedures (Kawashima, LV-PA conduit, other)",12.29.40,"Complex transposition of great arteries repair,",
390,TOF -  AVC (AVSD) repair,4390,Status post - TOF -  AVC (AVSD) repair,12.05.11,"Atrioventricular septal defect (AVSD) & Tetralogy of Fallot repair,",
400,TOF - Absent pulmonary valve repair,4400,Status post - TOF - Absent pulmonary valve repair,12.26.21,"Absent pulmonary valve syndrome (Fallot type) repair,",
350,"TOF repair, No ventriculotomy",4350,"Status post - TOF repair, No ventriculotomy",12.26.01,"Tetralogy of Fallot repair,",
380,"TOF repair, RV-PA conduit",4380,"Status post - TOF repair, RV-PA conduit",12.26.01,"Tetralogy of Fallot repair,",
360,"TOF repair, Ventriculotomy, Nontransanular patch",4360,"Status post - TOF repair, Ventriculotomy, Nontransanular patch",12.26.20,"Tetralogy of Fallot repair, Tetralogy of Fallot repair without transannular patch,",
370,"TOF repair, Ventriculotomy, Transanular patch",4370,"Status post - TOF repair, Ventriculotomy, Transanular patch",12.26.13,"Tetralogy of Fallot repair, Tetralogy of Fallot repair with transannular patch,",
3330,"TOF repair, Ventriculotomy, Transanular patch, plus native valve reconstruction",7330,"Status post - TOF repair, Ventriculotomy, Transanular patch, plus native valve reconstruction",12.26.13,"Tetralogy of Fallot repair, Tetralogy of Fallot repair with transannular patch,",
3340,"TOF repair, Ventriculotomy, Transanular patch, with monocusp or other surgically fashioned RVOT valve",7340,"Status post - TOF repair, Ventriculotomy, Transanular patch, with monocusp or other surgically fashioned RVOT valve",12.26.13,"Tetralogy of Fallot repair, Tetralogy of Fallot repair with transannular patch,",
900,"Transplant, Heart and lung",1610,"Status post - Transplant, Heart and lung",12.32.13,"Transplantation of heart and lungs,",
2220,Truncus + Interrupted aortic arch repair (IAA) repair,6220,Status post - Truncus + Interrupted aortic arch repair (IAA) repair,"12.11.00, 12.21.00",multiple_codes,2 ops
230,Truncus arteriosus repair,4230,Status post - Truncus arteriosus repair,12.11.00,"Common arterial trunk (truncus) repair,",
2880,Tumor of chest wall - Excision including ribs,6880,Status post - Tumor of chest wall - Excision including ribs,EXCLUDE,,Not CHD
2890,"Tumor of chest wall - Excision including ribs, With reconstruction",6890,"Status post - Tumor of chest wall - Excision including ribs, With reconstruction",EXCLUDE,,Not CHD
2960,Tumor of soft tissue of neck - Excision of deep subfascial or intramuscular tumor,6960,Status post - Tumor of soft tissue of neck - Excision of deep subfascial or intramuscular tumor,EXCLUDE,,Not CHD
2970,Tumor of soft tissue of neck - Excision of subcutaneous tumor,6970,Status post - Tumor of soft tissue of neck - Excision of subcutaneous tumor,EXCLUDE,,Not CHD
2980,Tumor of soft tissue of neck - Radical resection,6980,Status post - Tumor of soft tissue of neck - Radical resection,EXCLUDE,,Not CHD
2900,Tumor of soft tissue of thorax - Excision of deep subfascial or intramuscular tumor,6900,Status post - Tumor of soft tissue of thorax - Excision of deep subfascial or intramuscular tumor,EXCLUDE,,Not CHD
2910,Tumor of soft tissue of thorax - Excision of subcutaneous tumor,6910,Status post - Tumor of soft tissue of thorax - Excision of subcutaneous tumor,EXCLUDE,,Not CHD
2920,Tumor of soft tissue of thorax - Radical resection,6920,Status post - Tumor of soft tissue of thorax - Radical resection,EXCLUDE,,Not CHD
440,Unifocalization MAPCA(s),4440,Status post - Unifocalization MAPCA(s),12.25.00,"Systemic-to-pulmonary collateral artery(ies) (MAPCA(s)) unifocalisation procedure,",
2730,"Unifocalization MAPCA(s), Bilateral pulmonary unifocalization - Complete unifocalization (all usable MAPCA[s] are incorporated)",6730,"Status post - Unifocalization MAPCA(s), Bilateral pulmonary unifocalization - Complete unifocalization (all usable MAPCA[s] are incorporated)",12.28.11,"Pulmonary atresia, ventricular septal defect (VSD) & systemic-to-pulmonary collateral artery(ies) (MAPCA(s)) repair,",
2740,"Unifocalization MAPCA(s), Bilateral pulmonary unifocalization - Incomplete unifocalization (not all usable MAPCA[s] are incorporated)",6740,"Status post - Unifocalization MAPCA(s), Bilateral pulmonary unifocalization - Incomplete unifocalization (not all usable MAPCA[s] are incorporated)",12.28.11,"Pulmonary atresia, ventricular septal defect (VSD) & systemic-to-pulmonary collateral artery(ies) (MAPCA(s)) repair,",
2750,"Unifocalization MAPCA(s), Unilateral pulmonary unifocalization",6750,"Status post - Unifocalization MAPCA(s), Unilateral pulmonary unifocalization",12.28.11,"Pulmonary atresia, ventricular septal defect (VSD) & systemic-to-pulmonary collateral artery(ies) (MAPCA(s)) repair,",
3170,VAD change out,7170,Status post - VAD change out,12.87.41,"Cardiac support procedure, Ventricular assist device implantation, Ventricular assist device removal,",
2390,VAD explantation,6390,Status post - VAD explantation,12.87.41,"Cardiac support procedure, Ventricular assist device implantation, Ventricular assist device removal,",
480,"Valve closure, Tricuspid (exclusion, univentricular approach)",4480,"Status post - Valve closure, Tricuspid (exclusion, univentricular approach)",12.02.70,"Tricuspid valvar procedure, Tricuspid valvar closure,",
630,"Valve excision, Pulmonary (without replacement)",4630,"Status post - Valve excision, Pulmonary (without replacement)",12.13.12,"Pulmonary valvar procedure, Pulmonary valvectomy,",
490,"Valve excision, Tricuspid (without replacement)",4490,"Status post - Valve excision, Tricuspid (without replacement)",12.02.22,"Tricuspid valvar procedure, Tricuspid valvectomy,",
670,"Valve replacement, Aortic (AVR)",4670,"Status post - Valve replacement, Aortic (AVR)",12.16.21,"Aortic valvar procedure, Aortic valvar replacement,",
690,"Valve replacement, Aortic (AVR), Bioprosthetic",4690,"Status post - Valve replacement, Aortic (AVR), Bioprosthetic",12.16.28,"Aortic valvar procedure, Aortic valvar replacement, Aortic valvar replacement using heterograft bioprosthesis,",
700,"Valve replacement, Aortic (AVR), Homograft",4700,"Status post - Valve replacement, Aortic (AVR), Homograft",12.16.22,"Aortic valvar procedure, Aortic valvar replacement, Aortic valvar replacement using homograft,",
680,"Valve replacement, Aortic (AVR), Mechanical",4680,"Status post - Valve replacement, Aortic (AVR), Mechanical",12.16.29,"Aortic valvar procedure, Aortic valvar replacement, Aortic valvar replacement using mechanical prosthesis,",
470,"Valve replacement, Tricuspid (TVR)",4470,"Status post - Valve replacement, Tricuspid (TVR)",12.02.11,"Tricuspid valvar procedure, Tricuspid valvar replacement,",
250,"Valve replacement, Truncal valve",4250,"Status post - Valve replacement, Truncal valve",12.11.41,"Truncal valve replacement,",
800,"Valve surgery, Other, Aortic",4800,"Status post - Valve surgery, Other, Aortic",12.16.30,"Ross procedure: aortic valve or root replacement with pulmonary autograft & pulmonary valvar replacement,",
