sts_code_proc,sts_name_proc,sts_code_dx,sts_name_dx,epcc_code,epcc_name,comment
860,"Valve surgery, Other, Mitral",4860,"Status post - Valve surgery, Other, Mitral",12.03.19,"Mitral subvalvar apparatus procedure,",
650,"Valve surgery, Other, Pulmonic",4650,"Status post - Valve surgery, Other, Pulmonic",12.13.00,"Pulmonary valvar procedure,",
500,"Valve surgery, Other, Tricuspid",4500,"Status post - Valve surgery, Other, Tricuspid",12.02.00,"Tricuspid valvar procedure,",
2240,"Valvuloplasty converted to valve replacement in the same operation, Aortic",6240,"Status post - Valvuloplasty converted to valve replacement in the same operation, Aortic",12.16.97,"Aortic valvar procedure, Aortic valvar replacement, Aortic valve repair converted to aortic valvar replacement,",
2310,"Valvuloplasty converted to valve replacement in the same operation, Aortic  with Ross procedure",6310,"Status post - Valvuloplasty converted to valve replacement in the same operation, Aortic  with Ross procedure",12.16.30,"Ross procedure: aortic valve or root replacement with pulmonary autograft & pulmonary valvar replacement,",
2320,"Valvuloplasty converted to valve replacement in the same operation, Aortic  with Ross-Konno procedure",6320,"Status post - Valvuloplasty converted to valve replacement in the same operation, Aortic  with Ross-Konno procedure",12.16.62,"Ross-Konno procedure,",
2250,"Valvuloplasty converted to valve replacement in the same operation, Common atrioventricular valve",6250,"Status post - Valvuloplasty converted to valve replacement in the same operation, Common atrioventricular valve",12.04.33,"Common atrioventricular valve repair converted to atrioventricular valvar replacement,",
2260,"Valvuloplasty converted to valve replacement in the same operation, Mitral",6260,"Status post - Valvuloplasty converted to valve replacement in the same operation, Mitral",12.03.84,"Mitral valvar procedure, Mitral valve repair converted to mitral valvar replacement,",
2270,"Valvuloplasty converted to valve replacement in the same operation, Pulmonic",6270,"Status post - Valvuloplasty converted to valve replacement in the same operation, Pulmonic",12.13.55,"Pulmonary valve repair converted to pulmonary valvar replacement,",
2280,"Valvuloplasty converted to valve replacement in the same operation, Tricuspid",6280,"Status post - Valvuloplasty converted to valve replacement in the same operation, Tricuspid",12.02.83,"Tricuspid valvar procedure, Tricuspid valve repair converted to tricuspid valvar replacement,",
2290,"Valvuloplasty converted to valve replacement in the same operation, Truncal valve",6290,"Status post - Valvuloplasty converted to valve replacement in the same operation, Truncal valve",12.11.43,"Truncal valve repair converted to truncal valvar replacement,",
2300,"Valvuloplasty, Common atrioventricular valve",6300,"Status post - Valvuloplasty, Common atrioventricular valve",12.48.01,"Common atrioventricular valvar leaflet (valvoplasty) procedure,",
240,"Valvuloplasty, Truncal valve",4240,"Status post - Valvuloplasty, Truncal valve",12.11.34,"Truncal valve cusp(s) repair (valvoplasty),",
1360,Vascular ring repair,5360,Status post - Vascular ring repair,12.17.11,"Vascular ring procedure,",
1930,VATS (video-assisted thoracoscopic surgery),5930,Status post - VATS (video-assisted thoracoscopic surgery),EXCLUDE,,Irrelevant
1035,Ventricular septation,5035,Status post - Ventricular septation,12.09.01,"Ventricular septation procedure,",
110,"VSD repair, Patch",4110,"Status post - VSD repair, Patch",12.08.03,"Ventricular septal defect (VSD) closure, Ventricular septal defect (VSD) closure using patch,",
100,"VSD repair, Primary closure",4100,"Status post - VSD repair, Primary closure",12.08.02,"Ventricular septal defect (VSD) closure, Ventricular septal defect (VSD) closure by direct suture,",
130,"VSD, Multiple, Repair",4130,"Status post - VSD, Multiple, Repair",12.08.16,"Ventricular septal defect (VSD) closure, Closure of multiple ventricular septal defect (VSD)s,",
85,Atrialfenestrationclosure,4085,Status post - Atrial fenestration closure,12.30.41,"Atrial fenestration closure,",
120,"VSD repair, Device",4120,"Status post - VSD repair, Device",12.08.07,"Ventricular septal defect (VSD) closure with transluminal device,",
140,VSD creation/enlargement,4140,Status post - VSD creation/enlargement,12.08.35,"Ventricular septal defect (VSD) enlargement/ creation,",
150,Ventricular septal fenestration,4150,Status post - Ventricular septal fenestration,12.08.19,"Open fenestration of ventricular septal defect (VSD) patch,",
340,Systemic venous stenosis repair,4340,Status post - Systemic venous stenosis repair,12.00.83,"Systemic vein procedure, Systemic venous stenosis repair,",
420,"Pulmonary atresia - VSD (including TOF, PA) repair",4420,"Status post - Pulmonary atresia - VSD (including TOF, PA) repair",12.28.01,"Pulmonary atresia & ventricular septal defect (VSD) (including Fallot-type) repair,",
460,"Valvuloplasty, Tricuspid",4460,"Status post - Valvuloplasty, Tricuspid",12.02.04,"Tricuspid valvar procedure, Tricuspid valvar annuloplasty,",
510,RVOT procedure,4510,Status post - RVOT procedure,12.06.00,"Right ventricular outflow tract procedure,",
590,"Valvuloplasty, Pulmonic",4590,"Status post - Valvuloplasty, Pulmonic",12.13.00,"Pulmonary valvar procedure,",
600,"Valve replacement, Pulmonic (PVR)",4600,"Status post - Valve replacement, Pulmonic (PVR)",12.13.21,"Pulmonary valvar replacement (not conduit),",
640,"Valve closure, Semilunar",4640,"Status post - Valve closure, Semilunar",12.13.15,"Pulmonary valvar procedure, Pulmonary valve closure-oversewing,",
660,"Valvuloplasty, Aortic",4660,"Status post - Valvuloplasty, Aortic",12.16.11,"Aortic valvar procedure, Aortic cusp(s) repair (valvoplasty),",
830,"Valvuloplasty, Mitral",4830,"Status post - Valvuloplasty, Mitral",12.03.03,"Mitral valvar procedure, Mitral leaflet (valvoplasty) procedure,",
850,"Valve replacement, Mitral (MVR)",4850,"Status post - Valve replacement, Mitral (MVR)",12.03.11,"Mitral valvar procedure, Mitral valvar replacement,",
890,"Transplant, Heart",1590,"Status post - Transplant, Heart",12.37.01,"Heart transplant,",
920,Pericardial drainage procedure,4920,Status post - Pericardial drainage procedure,12.32.40,"Pericardiocentesis,",
940,"Pericardial procedure, Other",4940,"Status post - Pericardial procedure, Other",12.32.59,"Procedure involving pericardium,",
950,"Fontan, Atrio-pulmonary connection",4950,"Status post - Fontan, Atrio-pulmonary connection",12.30.32,"Fontan type procedure, Fontan procedure with direct atriopulmonary anastomosis,",
1025,Fontan revision or conversion (Re-do Fontan),5025,Status post - Fontan revision or conversion (Re-do Fontan),12.30.37,"Fontan type procedure, Fontan type procedure revision or conversion,",
1340,"PDA closure, Device",5340,"Status post - PDA closure, Device",12.24.04,"Arterial duct (PDA) closure with transluminal device,",
1410,"Transplant, lung(s)",1600,"Status post - Transplant, Lung(s)",12.37.20,"Lung(s) transplant, Double lung transplant,",
1420,"Lung procedure, Other",5420,"Status post - Lung procedure, Other",12.66.00,"Lung procedure,",
1440,Tracheal procedure,5440,Status post - Tracheal procedure,12.64.20,"Tracheal procedure,",
1450,"Pacemaker implantation, Permanent",5450,"Status post - Pacemaker implantation, Permanent",12.34.67,"Pacemaker system placement: permanent,",
1460,Pacemaker procedure,5460,Status post - Pacemaker procedure,12.34.68,"Pacemaker procedure,",
1470,ICD (AICD) implantation,5470,Status post - ICD (AICD) implantation,12.42.31,"Implantable cardioverter & defibrillator (ICD) implantation,",
1480,ICD (AICD) ([automatic] implantable cardioverter defibrillator) procedure,5480,Status post - ICD (AICD) ([automatic] implantable cardioverter defibrillator) procedure,12.42.39,"Implantable cardioverter & defibrillator (ICD) procedure,",
1590,"Shunt, Systemic to pulmonary, Modified Blalock-Taussig Shunt (MBTS)",5590,"Status post - Shunt, Systemic to pulmonary, Modified Blalock-Taussig Shunt (MBTS)",12.31.46,"Systemic-to-pulmonary arterial shunt procedure, Modified Blalock interposition shunt,",
1610,"Shunt, Systemic to pulmonary, Other",5610,"Status post - Shunt, Systemic to pulmonary, Other",12.31.06,"Systemic-to-pulmonary arterial shunt procedure, Central systemic-to-pulmonary arterial interposition shunt,",
1640,PA banding (PAB),5640,Status post - PA banding (PAB),12.14.02,"Pulmonary trunk band (PA band),",
1802,"Pulmonary embolectomy, Acute pulmonary embolus",5802,"Status post - Pulmonary embolectomy, Acute pulmonary embolus",12.15.80,"Pulmonary thromboembolectomy for acute embolus,",
1820,"Pleural procedure, Other",5820,"Status post - Pleural procedure, Other",12.65.89,"Pleural procedure,",
1860,Mediastinal procedure,5860,Status post - Mediastinal procedure,12.65.06,"Mediastinal procedure,",
1900,Intraaortic balloon pump (IABP) insertion,5900,Status post - Intraaortic balloon pump (IABP) insertion,12.87.10,"Cardiac support procedure, Intra-aortic balloon pump (IABP) insertion,",
1940,Minimally invasive procedure,5940,Status post - Minimally invasive procedure,12.40.13,"Minimally invasive procedure,",
1990,"Thoracotomy, Other",5990,"Status post - Thoracotomy, Other",12.40.00,"Thoracotomy,",
2020,"Thoracic and/or mediastinal procedure, Other",6020,"Status post - Thoracic and/or mediastinal procedure, Other",12.40.00,"Thoracotomy,",
2230,"Valve replacement, Common atrioventricular valve",6230,"Status post - Valve replacement, Common atrioventricular valve",12.80.00,"Thoracic-mediastinal procedure,",
2380,VAD implantation,6380,Status post - VAD implantation,12.87.21,"Cardiac support procedure, Ventricular assist device implantation,",
2580,"Cardiovascular catheterization procedure, Therapeutic, Septostomy",6580,"Status post - Cardiovascular catheterization procedure, Therapeutic, Septostomy",12.01.41,"Balloon atrial septostomy by pull back (Rashkind),",
3030,"Pectus repair, Open repair",7030,"Status post - Pectus repair, Open repair",12.65.23,"Anterior chest wall (pectus) repair,",
7777,Other procedure,11777,Status post - Other procedure,ERROR,,too non-specific
